3.1	"\"2451, North Rainbow Boulevard, Inner Northwest, Las Vegas, Clark County, Nevada, 89108, United States of America\",\"36.2043234712583\",\"-115.242353953796\""
7.1	"\"1501, Coal City Road, Coal City, Raleigh County, West Virginia, 25823, United States of America\",\"37.7010684690848\",\"-81.2139168691116\""
13.1	"\"East 56th Street, East Flatbush, Brooklyn, Kings County, NYC, New York, 11203, United States of America\",\"40.654162\",\"-73.9248209\""
14.1	"\"East 56th Street, East Flatbush, Brooklyn, Kings County, NYC, New York, 11203, United States of America\",\"40.654162\",\"-73.9248209\""
15.1	"\"East 56th Street, East Flatbush, Brooklyn, Kings County, NYC, New York, 11203, United States of America\",\"40.654162\",\"-73.9248209\""
16.1	"\"327, East Pascagoula Street, Jackson, Hinds County, Mississippi, 39201, United States of America\",\"32.2974779275522\",\"-90.1842089589924\""
22.1	"\"Saint John Street, Portland, Cumberland County, Maine, 04102, United States of America\",\"43.6558149\",\"-70.2803039\""
25.1	"\"Dogwood Road, Windsor Mill, Hollifield, Baltimore County, Maryland, 21244, United States of America\",\"39.3206613\",\"-76.7605999\""
28.1	"\"North Hayne Street, Pensacola, Escambia County, Florida, 32503, United States of America\",\"30.4210993\",\"-87.2131179\""
30.1	"\"33230, Ryan Drive, Leesburg, Lake County, Florida, 34788, United States of America\",\"28.8332225\",\"-81.8195089090909\""
37.1	"\"813, Snow Street, Oxford, Calhoun County, Alabama, 36203, United States of America\",\"33.6150428728782\",\"-85.8208218559034\""
38.1	"\"3636, College Street, College Park, Fulton County, Georgia, 30337, United States of America\",\"33.656185\",\"-84.4514269\""
43.1	"\"3633, West Ball Road, Anaheim, Orange County, California, 92804, United States of America\",\"33.8173039706584\",\"-118.01365481191\""
45.1	"\"Cedar Avenue, Macon, Bibb County, Georgia, 31204, United States of America\",\"32.824545\",\"-83.6640689\""
46.1	"\"555, Main Street, Central City, Capitol Hill, Salt Lake City, Salt Lake County, Utah, 84111, United States of America\",\"40.7572910816419\",\"-111.890977424909\""
49.1	"\"947, Rockefeller Lane, Madison, Dane County, Wisconsin, 53704, United States of America\",\"43.1110401333333\",\"-89.2977879333333\""
52.1	"\"609, Lions Park Place, Midwest City, Oklahoma County, Oklahoma, 73110, United States of America\",\"35.444068647317\",\"-97.3881623087951\""
54.1	"\"Main Road South, Hampden, Penobscot County, Maine, 04444, United States of America\",\"44.719885\",\"-68.8451569\""
58.1	"\"Brookwood Road, Alexander, Saline County, Arkansas, 72002, United States of America\",\"34.6126833\",\"-92.461781\""
59.1	"\"Whitley Avenue, Hollywood, LA, Los Angeles County, California, 90068, United States of America\",\"34.1022341\",\"-118.3333346\""
63.1	"\"551, West Whitestone Boulevard, Cedar Park, Williamson County, Texas, 78613, United States of America\",\"30.51984\",\"-97.833552\""
64.1	"\"5200, Hammersley Road, Madison, Dane County, Wisconsin, 53711, United States of America\",\"43.039196580578\",\"-89.4685587350113\""
69.1	"\"Covington Highway, Avondale Estates, DeKalb County, Georgia, 30002, United States of America\",\"33.773819\",\"-84.2580919\""
71.1	"\"Montgomery Highway, Dothan, Houston County, Alabama, 36303, United States of America\",\"31.269063\",\"-85.4462929\""
70.1	"\"Chester Street, Eureka, Humboldt County, California, 95503, United States of America\",\"40.778639\",\"-124.1420119\""
83.1	"\"South Road, Harmony, Somerset County, Maine, 04942, United States of America\",\"44.948784\",\"-69.5454279\""
84.1	"\"Upper Sumner Hill Road, Sumner, Oxford County, Maine, 04292, United States of America\",\"44.363593\",\"-70.4187759\""
85.1	"\"Lexington Park Drive, West Valley City, Salt Lake County, Utah, 84119, United States of America\",\"40.6919301\",\"-111.9504463\""
89.1	"\"34500, 16th Avenue South, Federal Way, King County, Washington, 98003, United States of America\",\"47.2914065764331\",\"-122.313628748408\""
95.1	"\"2427, West Pawnee Street, Wichita, Sedgwick County, Kansas, 67213, United States of America\",\"37.6512976363636\",\"-97.3700223636364\""
101.1	"\"Stone Way Hardware, 4318, Stone Way North, Fremont, Wallingford, Seattle, King County, Washington, 98103, United States of America\",\"47.6597851\",\"-122.3419416\""
102.1	"\"Myrtle Avenue, Fort Greene, Brooklyn, Kings County, NYC, New York, 11237, United States of America\",\"40.6932825\",\"-73.9735206\""
103.1	"\"Olive Street, Northwest Woods, Hinesville, Liberty County, Georgia, 31313, United States of America\",\"31.848974\",\"-81.6110519\""
106.1	"\"Simmons Road, Pleasantdale, South Portland, Cumberland County, Maine, 04106, United States of America\",\"43.625998\",\"-70.2528429\""
110.1	"\"3187, East Point Street, East Point, Fulton County, Georgia, 30344, United States of America\",\"33.6686354444444\",\"-84.4458067777778\""
120.1	"\"1402, West Buckeye Avenue, ספוקיין, Spokane County, Washington, 99205, United States of America\",\"47.6827199591837\",\"-117.432611755102\""
122.1	"\"4742, Brookhaven Road, Macon, Bibb County, Georgia, 31206, United States of America\",\"32.8173865292968\",\"-83.7201907938301\""
121.1	"\"3501, Foster Avenue, East Flatbush, Brooklyn, Kings County, NYC, New York, 11203, United States of America\",\"40.6394295\",\"-73.943263822719\""
130.1	"\"6130, Chattahoochee Street, Lula, Hall County, Georgia, 30554, United States of America\",\"34.3908394899479\",\"-83.6633318294135\""
131.1	"\"Washington Avenue, Miami Beach, Miami-Dade County, Florida, 33139, United States of America\",\"25.7746474\",\"-80.1340779\""
132.1	"\"Boca Raton, Palm Beach County, Florida, 33432, United States of America\",\"26.3375045\",\"-80.0734513\""
135.1	"\"Reed Street, Waycross, Ware County, Georgia, 31501, United States of America\",\"31.208918\",\"-82.3462909\""
136.1	"\"3640, East Cork Street, Kalamazoo, Kalamazoo County, Michigan, 49001, United States of America\",\"42.2600117565175\",\"-85.5345809386355\""
137.1	"\"6613, West 15th Place, Sioux Falls, Minnehaha County, South Dakota, 57106, United States of America\",\"43.5416023673469\",\"-96.8065810408163\""
139.1	"\"245, Watkins Road, Peckerwood Point, Tipton County, Tennessee, 38023, United States of America\",\"35.4339124700852\",\"-89.8977906495742\""
164.1	"\"3576, Beulah Road, Columbus, Franklin County, Ohio, 43224, United States of America\",\"40.0380241702082\",\"-82.9942061055905\""
169.1	"\"Main Street, Albion, Kennebec County, Maine, 04910, United States of America\",\"44.532904\",\"-69.4380729\""
170.1	"\"190, West Valencia Road, Tucson, Pima County, Arizona, 85706, United States of America\",\"32.134125\",\"-110.970746\""
171.1	"\"416, East State Street, Meridian, Ada County, Idaho, 83642, United States of America\",\"43.6130170408163\",\"-116.38614877551\""
174.1	"\"Super 8, 1304, 4th Street, Eureka, Humboldt County, California, 95501, United States of America\",\"40.80376505\",\"-124.156849354052\""
181.1	"\"2401, South Park Street, Madison, Dane County, Wisconsin, 53713, United States of America\",\"43.039955\",\"-89.393899\""
185.1	"\"Olive Street, Northwest Woods, Hinesville, Liberty County, Georgia, 31313, United States of America\",\"31.848974\",\"-81.6110519\""
190.1	"\"East 180th Street, West Farms, Bronx, St. Andrews Village, Bronx County, NYC, New York, 10460, United States of America\",\"40.840869\",\"-73.8728079\""
193.1	"\"Ulatis Drive, Leisure Town, Vacaville, Solano County, California, 95687, United States of America\",\"38.3573371\",\"-121.9550554\""
195.1	"\"48, North Hunt Drive, Mesa, Maricopa County, Arizona, 85203, United States of America\",\"33.415599877551\",\"-111.798162295918\""
194.1	"\"White Plains Hospital Center, 41, East Post Road, White Plains, Westchester County, New York, 10601, United States of America\",\"41.0262085\",\"-73.7690209\""
204.1	"\"West 14th Avenue, Greenville, Pitt County, North Carolina, 27834, United States of America\",\"35.6072092\",\"-77.3848573\""
213.1	"\"South Ellsworth Road, Mesa, Maricopa County, Arizona, 85207; 85208, United States of America\",\"33.3067699\",\"-111.6353466\""
215.1	"\"I 575;GA 5, Holly Springs, Cherokee County, Georgia, 30114, United States of America\",\"34.180051\",\"-84.5074729\""
220.1	"\"Manchester Road, Rock Hill, St. Louis County, Missouri, 63011, United States of America\",\"38.6107222\",\"-90.3603107\""
225.1	"\"Fegenbush Lane, Louisville, Jefferson County, Kentucky, 40228, United States of America\",\"38.143006\",\"-85.6237219\""
228.1	"\"East Griffin Avenue, Attapulgus, Decatur County, Georgia, 39815, United States of America\",\"30.7488773\",\"-84.4792799\""
233.1	"\"Olive Street, Northwest Woods, Hinesville, Liberty County, Georgia, 31313, United States of America\",\"31.848974\",\"-81.6110519\""
240.1	"\"West Grand Street, Springfield, Greene County, Missouri, 65802, United States of America\",\"37.1970497\",\"-93.3071003\""
245.1	"\"3201, Airport Way, Boise City, Ada County, Idaho, 83705, United States of America\",\"43.5710705492096\",\"-116.222732795544\""
250.1	"\"Fairview Avenue, Dover-Foxcroft, Piscataquis County, Maine, 04426, United States of America\",\"45.188825\",\"-69.2203599\""
253.1	"\"3201, Airport Way, Boise City, Ada County, Idaho, 83705, United States of America\",\"43.5710705492096\",\"-116.222732795544\""
256.1	"\"1411, West 16th Avenue, Pine Bluff, Jefferson County, Arkansas, 71603, United States of America\",\"34.2132338979592\",\"-92.0162605306122\""
257.1	"\"976, Cascade Road, Atlanta, Fulton County, Georgia, 30311, United States of America\",\"33.728417\",\"-84.442307\""
259.1	"\"4608, Brockton Drive, Millbrook, Raleigh, Wake County, North Carolina, 27604, United States of America\",\"35.8425066032244\",\"-78.5966760593785\""
263.1	"\"Widefield Boulevard, Security-Widefield, El Paso County, Colorado, 80911, United States of America\",\"38.7319306\",\"-104.7244704\""
264.1	"\"Bowman Street, Farmingdale, Kennebec County, Maine, 04344, United States of America\",\"44.247045\",\"-69.7869049\""
265.1	"\"1485, West 46th Street, Hialeah, Miami-Dade County, Florida, 33012, United States of America\",\"25.8639878272725\",\"-80.3118098183333\""
267.1	"\"Olive Street, Northwest Woods, Hinesville, Liberty County, Georgia, 31313, United States of America\",\"31.848974\",\"-81.6110519\""
269.1	"\"1523, East Main Street, Cushing, Payne County, Oklahoma, 74023, United States of America\",\"35.9849395789474\",\"-96.7472006842105\""
275.1	"\"2600, East Silver Street, Samos, Tucson, Pima County, Arizona, 85716, United States of America\",\"32.252816\",\"-110.933086\""
284.1	"\"Benthollow Lane, Chattawood, Duluth, Gwinnett County, Georgia, 30096, United States of America\",\"33.9969478\",\"-84.1556536\""
287.1	"\"8201, Santa Ana Canyon Road, Savi Ranch, Anaheim, Orange County, California, 92808, United States of America\",\"33.8685680613078\",\"-117.748624780532\""
296.1	"\"3300, West Wagoner Road, Phoenix, Maricopa County, Arizona, 85053, United States of America\",\"33.65335\",\"-112.130294\""
301.1	"\"Covington Highway, Avondale Estates, DeKalb County, Georgia, 30002, United States of America\",\"33.773819\",\"-84.2580919\""
303.1	"\"16098, East Ithaca Place, Aurora, Arapahoe County, Colorado, 80013, United States of America\",\"39.651834\",\"-104.799908\""
304.1	"\"Macon Highway, Athens-Clarke County, Clarke County, Georgia, Ga, United States of America\",\"33.9150315\",\"-83.3967423\""
309.1	"\"Shastina Drive, Weed, Siskiyou County, California, 96094, United States of America\",\"41.405721\",\"-122.3798949\""
314.1	"\"238, Holiday Lodge Road, North Liberty, Johnson County, Iowa, 52317, United States of America\",\"41.7379713468587\",\"-91.6035381143654\""
317.1	"\"1528, Jefferson Avenue, Brunswick, Medina County, Ohio, 44212, United States of America\",\"41.2338693561644\",\"-81.8466451917808\""
320.1	"\"1192, South L and N Turnpike, Magnolia, Larue County, Kentucky, 42716, United States of America\",\"37.4854725493091\",\"-85.7110880976954\""
321.1	"\"Watson Road, Hillsboro, Fleming County, Kentucky, United States of America\",\"38.29416\",\"-83.6299309\""
327.1	"\"Alondra Boulevard, Bellflower, Los Angeles County, California, 90650, United States of America\",\"33.8880288\",\"-118.1114687\""
331.1	"\"Windsor Town Green, McClelland Drive, Windsor, Sonoma County, California, 95492, United States of America\",\"38.54890475\",\"-122.814901292595\""
335.1	"\"East Broadway Boulevard, Tucson, Pima County, Arizona, 85748, United States of America\",\"32.2214084\",\"-110.8971874\""
337.1	"\"412, West I Street, Russellville, Pope County, Arkansas, 72801, United States of America\",\"35.2867687407674\",\"-93.1364536683469\""
344.1	"\"5823, Era Avenue, St. Louis, City of St. Louis, Missouri, 63147, United States of America\",\"38.712232\",\"-90.253317\""
341.1	"\"Longview, Cowlitz County, Washington, 98632, United States of America\",\"46.1658069\",\"-123.0137374\""
346.1	"\"3207, Albee Street, Eureka, Humboldt County, California, 95503, United States of America\",\"40.7790549387755\",\"-124.175635816327\""
347.1	"\"319, Locust Street, Duluth, Saint Louis County, Minnesota, 55811, United States of America\",\"46.8029064147379\",\"-92.1402348399373\""
351.1	"\"3001, Lake East Drive, The Lakes, Las Vegas, Clark County, Nevada, 89117, United States of America\",\"36.135744\",\"-115.282466\""
350.1	"\"1506, East 5th Street, Willowville, Long Beach, Los Angeles County, California, 90802, United States of America\",\"33.7726361414141\",\"-118.172754444444\""
354.1	"\"3916, Grand Meadow Street, Sun City Summerlin, Las Vegas, Clark County, Nevada, 89129, United States of America\",\"36.2324313740414\",\"-115.305141994982\""
358.1	"\"6333, Hobart Avenue, Charleston Heights, Las Vegas, Clark County, Nevada, 89107, United States of America\",\"36.1778163928078\",\"-115.23048155438\""
359.1	"\"Theresa Avenue, Five Points, Las Vegas, Clark County, Nevada, 89101, United States of America\",\"36.18284\",\"-115.1030428\""
360.1	"\"6629, Nevada Classic Circle, Desert Shores, Las Vegas, Clark County, Nevada, 89108, United States of America\",\"36.2341882882562\",\"-115.241901035584\""
366.1	"\"428, North 15th Street, Cultural Corridor, Five Points, Las Vegas, Clark County, Nevada, 89101, United States of America\",\"36.1716008615166\",\"-115.12699473409\""
369.1	"\"East Desert Inn Road, Five Points, Las Vegas, Clark County, Nevada, 89109, United States of America\",\"36.1297916\",\"-115.0845073\""
372.1	"\"1849, Harvard Street, North Las Vegas, Clark County, Nevada, 89030, United States of America\",\"36.1930809563525\",\"-115.135014084192\""
376.1	"\"North Jones Boulevard, Inner Northwest, Las Vegas, Clark County, Nevada, 89108, United States of America\",\"36.2279402\",\"-115.2255925\""
377.1	"\"South Nellis Boulevard, North Las Vegas, Clark County, Nevada, 89101, United States of America\",\"36.126503\",\"-115.0652218\""
378.1	"\"4450, Karen Avenue, Sunrise Manor, Clark County, Nevada, 89121, United States of America\",\"36.1407276778524\",\"-115.076751436242\""
368.1	"\"3791, Shirebrook Drive, Sunrise Manor, Clark County, Nevada, 89115, United States of America\",\"36.2126590989508\",\"-115.0918956657\""
382.1	"\"2830, Magnolia Street, Hoover-Foster, Oakland, Alameda County, California, 94608, United States of America\",\"37.8208440400276\",\"-122.283156712717\""
384.1	"\"Bromley Avenue, Charleston Heights, Las Vegas, Clark County, Nevada, 89107, United States of America\",\"36.1769745\",\"-115.2129505\""
386.1	"\"7101, International Boulevard, Lockwood Gardens, Oakland, Alameda County, California, 94621, United States of America\",\"37.7601430505051\",\"-122.189388050505\""
387.1	"\"650, Northeast Holladay Street, Lloyd District, Portland, Multnomah County, Oregon, 97232, United States of America\",\"45.5298066\",\"-122.6591279\""
388.1	"\"1230, Comstock Drive, Vegas Heights, Las Vegas, Clark County, Nevada, 89106, United States of America\",\"36.1847374796317\",\"-115.165259200484\""
391.1	"\"Saint Rose Parkway, Seven Hills, Henderson, Clark County, Nevada, 89052, United States of America\",\"36.0070754\",\"-115.1142872\""
393.1	"\"3029, Brady Avenue, Five Points, Las Vegas, Clark County, Nevada, 89101, United States of America\",\"36.1815991953725\",\"-115.105844713955\""
394.1	"\"1591, Chartered Circle, Five Points, Las Vegas, Clark County, Nevada, 89101, United States of America\",\"36.1875583306994\",\"-115.112785671285\""
395.1	"\"6252, Chinook Way, Charleston Heights, Las Vegas, Clark County, Nevada, 89108, United States of America\",\"36.1825714798006\",\"-115.228754263539\""
396.1	"\"4607, Northeast Shaver Street, Alameda, Portland, Multnomah County, Oregon, 97213, United States of America\",\"45.5519688210882\",\"-122.616067174206\""
399.1	"\"1476, Living Desert Drive, Midtown UNLV, Las Vegas, Clark County, Nevada, 89119, United States of America\",\"36.1067698664545\",\"-115.133401120497\""
401.1	"\"805, Dolores Drive, Inner Northwest, Las Vegas, Clark County, Nevada, 89107, United States of America\",\"36.1803770742488\",\"-115.240617\""
402.1	"\"Southeast Stark Street, Russellville, Portland, Multnomah County, Oregon, 97220, United States of America\",\"45.5190533\",\"-122.5636953\""
404.1	"\"3825, Cambridge Street, Midtown UNLV, Las Vegas, Clark County, Nevada, 89119, United States of America\",\"36.1198198091642\",\"-115.141968815935\""
405.1	"\"955, East Twain Avenue, Hughes Center, Las Vegas, Clark County, Nevada, 89169, United States of America\",\"36.1220751484795\",\"-115.142840152964\""
406.1	"\"10123, Southeast Market Street, Russellville, Portland, Multnomah County, Oregon, 97216, United States of America\",\"45.5113388716994\",\"-122.559381160277\""
407.1	"\"12110, East Burnside Street, Russellville, Portland, Multnomah County, Oregon, 97216, United States of America\",\"45.522417\",\"-122.538420444444\""
410.1	"\"South Eastern Avenue, Green Valley, Las Vegas, Clark County, Nevada, 89123, United States of America\",\"36.0532152\",\"-115.1182422\""
411.1	"\"4943, Terra Circle, Las Vegas, Clark County, Nevada, 89120, United States of America\",\"36.0991772381634\",\"-115.069497539689\""
412.1	"\"1029, Sierra Vista Drive, Midtown UNLV, Las Vegas, Clark County, Nevada, 89169, United States of America\",\"36.1268338920149\",\"-115.140837463605\""
416.1	"\"1480, West Lake Mead Boulevard, Vegas Heights, Las Vegas, Clark County, Nevada, 89106, United States of America\",\"36.1957848181818\",\"-115.160456818182\""
418.1	"\"2227, Cambridge Elms Street, North Las Vegas, Clark County, Nevada, 89032, United States of America\",\"36.2001088606249\",\"-115.171309969082\""
424.1	"\"West Desert Inn Road, Chinatown, Las Vegas, Clark County, Nevada, 89117, United States of America\",\"36.130001\",\"-115.2001788\""
429.1	"\"1116, Fremont Street, Cultural Corridor, Five Points, Las Vegas, Clark County, Nevada, 89101, United States of America\",\"36.1661051267788\",\"-115.133592535252\""
431.1	"\"Eastside Cannery Casino Hotel, 5255, Boulder Highway, Sunrise Manor, Clark County, Nevada, 89122, United States of America\",\"36.10760025\",\"-115.056180526721\""
435.1	"\"801, South Pavilion Center Drive, The Vistas, Las Vegas, Clark County, Nevada, 89144, United States of America\",\"36.1642833448295\",\"-115.332587803136\""
440.1	"\"Hampton Court Apartments, 3955, Swenson Street, Hughes Center, Las Vegas, Clark County, Nevada, 89119, United States of America\",\"36.1174283\",\"-115.1477084\""
446.1	"\"5535, Scoville Street, Melrose, Oakland, Alameda County, California, 94621, United States of America\",\"37.7692474365883\",\"-122.199925037757\""
447.1	"\"Boulder Highway, Water Street District, Downtown Henderson, Henderson, Clark County, Nevada, 89015, United States of America\",\"36.0395484\",\"-114.9821871\""
449.1	"\"701, Skyline Road, Downtown Henderson, Henderson, Clark County, Nevada, 89002, United States of America\",\"36.0084319333193\",\"-114.981000805909\""
450.1	"\"5319, Bethel Lane, Hughes Center, Las Vegas, Clark County, Nevada, 89119, United States of America\",\"36.093131898802\",\"-115.168968854639\""
451.1	"\"2700, North Rainbow Boulevard, Inner Northwest, Las Vegas, Clark County, Nevada, 89108, United States of America\",\"36.2109286684001\",\"-115.242165994654\""
452.1	"\"4000, Southwest Fairview Boulevard, Sylvan, Portland, Multnomah County, Oregon, 97221, United States of America\",\"45.514504\",\"-122.717955\""
453.1	"\"9745, Grand Teton Drive, Tule Springs, Las Vegas, Clark County, Nevada, 89149, United States of America\",\"36.3065938560717\",\"-115.307043512331\""
454.1	"\"610, Greenway Road, Mission Hills, Henderson, Clark County, Nevada, 89002, United States of America\",\"36.0111708006113\",\"-114.976773521717\""
455.1	"\"7240, North Fessenden Street, Saint Johns, Portland, Multnomah County, Oregon, 97203, United States of America\",\"45.5940018163265\",\"-122.737807142857\""
458.1	"\"1111, North Michael Way, Charleston Heights, Las Vegas, Clark County, Nevada, 89108, United States of America\",\"36.1826744134276\",\"-115.215160896163\""
459.1	"\"9124, Northeast Glisan Street, Montavilla, Portland, Multnomah County, Oregon, 97220, United States of America\",\"45.526270787234\",\"-122.569681638298\""
465.1	"\"2025, Canosa Avenue, Five Points, Las Vegas, Clark County, Nevada, 89104, United States of America\",\"36.1497550316762\",\"-115.120551427241\""
466.1	"\"2635, Parker Avenue, Eastmont, Oakland, Alameda County, California, 94605, United States of America\",\"37.7641308941055\",\"-122.17159349751\""
467.1	"\"4000, Southeast 82nd Avenue, Arleta, Montavilla, Portland, Multnomah County, Oregon, 97266, United States of America\",\"45.493314\",\"-122.57865\""
471.1	"\"7712, Golden Talon Avenue, Tule Springs, Las Vegas, Clark County, Nevada, 89131, United States of America\",\"36.293359\",\"-115.264051\""
473.1	"\"5574, West Alexander Road, Inner Northwest, Las Vegas, Clark County, Nevada, 89130, United States of America\",\"36.2318639500102\",\"-115.218497159394\""
476.1	"\"2125, Las Vegas Boulevard North, North Las Vegas, Clark County, Nevada, 89030, United States of America\",\"36.1987929110803\",\"-115.125468075937\""
477.1	"\"333, South Las Vegas Boulevard, John S. Park, Five Points, Las Vegas, Clark County, Nevada, 89101, United States of America\",\"36.1664619903149\",\"-115.142372112556\""
479.1	"\"Greyhound, 550, Northwest 6th Avenue, Pearl District, Portland, Multnomah County, Oregon, 97209, United States of America\",\"45.5272112\",\"-122.676175022911\""
481.1	"\"1111, Northeast 102nd Avenue, Russellville, Portland, Multnomah County, Oregon, 97220, United States of America\",\"45.5307816734694\",\"-122.558203387755\""
482.1	"\"3650, Florrie Avenue, Las Vegas, Clark County, Nevada, 89121, United States of America\",\"36.1233717449298\",\"-115.079462301293\""
483.1	"\"Boulder Highway, Sunrise Manor, Clark County, Nevada, 89121, United States of America\",\"36.1398718\",\"-115.094627\""
490.1	"\"East Greenbrae Drive, Sparks, Washoe County, Nevada, 89434, United States of America\",\"39.544223\",\"-119.7267548\""
494.1	"\"1000, Macdonald Ranch Drive, Macdonald Ranch, Henderson, Clark County, Nevada, 89012, United States of America\",\"36.0033136818451\",\"-115.041588847852\""
495.1	"\"931, North Skidmore Street, Piedmont, Portland, Multnomah County, Oregon, 97217, United States of America\",\"45.554707\",\"-122.676223\""
497.1	"\"2701, 64th Avenue, Seminary Park, Oakland, Alameda County, California, 94605, United States of America\",\"37.7704001070723\",\"-122.185231205779\""
498.1	"\"1355, East 32nd Street, Highland Park, Oakland, Alameda County, California, 94602, United States of America\",\"37.8001483487789\",\"-122.232418318339\""
503.1	"\"930, North Lamb Boulevard, Sunrise, Las Vegas, Clark County, Nevada, 89110, United States of America\",\"36.1811288158273\",\"-115.080448130935\""
506.1	"\"2842, Taurus Court, Sunrise Manor, Clark County, Nevada, 89115, United States of America\",\"36.2108754310303\",\"-115.092953229912\""
510.1	"\"8500, San Leandro Street, Arcadia Park, Oakland, Alameda County, California, 94601, United States of America\",\"37.747003\",\"-122.189049\""
512.1	"\"5552, Taft Avenue, Rockridge, Oakland, Alameda County, California, 94618, United States of America\",\"37.8427524936154\",\"-122.249160469929\""
513.1	"\"5055, Telegraph Avenue, Temescal, Oakland, Alameda County, California, 94609, United States of America\",\"37.8369423223601\",\"-122.262553701364\""
514.1	"\"North Nellis Boulevard, Sunrise, Las Vegas, Clark County, Nevada, 89115, United States of America\",\"36.170291\",\"-115.0621149\""
515.1	"\"10123, Southeast Market Street, Russellville, Portland, Multnomah County, Oregon, 97216, United States of America\",\"45.5113388716994\",\"-122.559381160277\""
516.1	"\"9801, Crystalline Drive, Stead, Reno, Washoe County, Nevada, 89506, United States of America\",\"39.6372667659446\",\"-119.870308251965\""
517.1	"\"2895, East Charleston Boulevard, Five Points, Las Vegas, Clark County, Nevada, 89104, United States of America\",\"36.1588057194943\",\"-115.109952455448\""
522.1	"\"1616, Rising Pebble Court, North Las Vegas, Clark County, Nevada, 89031, United States of America\",\"36.2596237043522\",\"-115.164548773389\""
524.1	"\"671, East Naples Drive, Midtown UNLV, Las Vegas, Clark County, Nevada, 89119, United States of America\",\"36.1056081251642\",\"-115.149637457421\""
527.1	"\"2304, Tam Drive, 18b Arts District, Twin Lakes, Las Vegas, Clark County, Nevada, 89102, United States of America\",\"36.1457524597275\",\"-115.162279557411\""
530.1	"\"618, Severn Street, Mission Hills, Henderson, Clark County, Nevada, 89002, United States of America\",\"36.010655\",\"-114.978256\""
531.1	"\"6401, Bristol Way, Charleston Heights, Las Vegas, Clark County, Nevada, 89107, United States of America\",\"36.162832\",\"-115.23331\""
