3194.1	"\"Southeast Ely Street, Oak Harbor, Island County, Washington, 98277, United States of America\",\"48.293246\",\"-122.6522499\""
3195.1	"\"Wells Fargo Bank, 13273, Aurora Avenue North, Haller Lake, Seattle, King County, Washington, 98133, United States of America\",\"47.7265127\",\"-122.345614\""
3197.1	"\"17th Street Southeast, Auburn, King County, Washington, 98002, United States of America\",\"47.293734\",\"-122.2085194\""
3201.1	"\"325, East Pioneer Avenue, Puyallup, Pierce County, Washington, 98372, United States of America\",\"47.1905332244898\",\"-122.290784265306\""
3204.1	"\"BestWestern Loyal Inn, 2301, 8th Avenue, Belltown, Seattle, King County, Washington, 98121, United States of America\",\"47.61810765\",\"-122.341252584808\""
3202.1	"\"Pacific Lutheran University, 124th Street South, Parkland, Pierce County, Washington, 98444, United States of America\",\"47.14521455\",\"-122.445021840957\""
3205.1	"\"3014, Southwest Genesee Street, Delridge, Seattle, King County, Washington, 98126, United States of America\",\"47.56492725\",\"-122.371577335325\""
3208.1	"\"5900, South 2600 West, Roy, Weber County, Utah, 84067, United States of America\",\"41.1564347389355\",\"-112.042570933412\""
3209.1	"\"8950, Southwest 56th Terrace, South Miami, Sunset, Miami-Dade County, Florida, 33173, United States of America\",\"25.7156263939394\",\"-80.3397452929293\""
3215.1	"\"811, Southeast 22nd Avenue, Pompano Beach, Broward County, Florida, 33062, United States of America\",\"26.2208256838307\",\"-80.1024268896954\""
3218.1	"\"Ocean Boulevard, Saint Simons, Glynn County, Georgia, 31522, United States of America\",\"31.135823\",\"-81.3852749\""
3220.1	"\"3431, South Pacific Highway, Medford, Jackson County, Oregon, 97501, United States of America\",\"42.28891025\",\"-122.83488945\""
3221.1	"\"5333, East Ocean Boulevard, Belmont Shore, Long Beach, Los Angeles County, California, 90803, United States of America\",\"33.7547013169034\",\"-118.134464106559\""
3222.1	"\"Brogan Avenue, Anderson, Anderson County, South Carolina, 29625, United States of America\",\"34.511057\",\"-82.6740149\""
3225.1	"\"220, Porcher Avenue, Eutawville, Orangeburg County, South Carolina, 29048, United States of America\",\"33.3951088295397\",\"-80.3467363579153\""
3227.1	"\"Auburn Street, Allentown, Lehigh County, penna, 18103, United States of America\",\"40.596082\",\"-75.4624939\""
3228.1	"\"Holiday Inn Express, 611, Lakehurst Road, Waukegan, Lake County, Illinois, 60085, United States of America\",\"42.339427\",\"-87.897298\""
3231.1	"\"99, Ascension Drive, Asheville, Buncombe County, North Carolina, 28806, United States of America\",\"35.598258\",\"-82.609653\""
3238.1	"\"200, 7th Street West, St. Paul, Ramsey County, Minnesota, 55102, United States of America\",\"44.9440672072059\",\"-93.1030612084952\""
3246.1	"\"2724, Linden Boulevard, East New York, Kings County, NYC, New York, 11208, United States of America\",\"40.66870835\",\"-73.8639251169468\""
3248.1	"\"511, Sycamore Street, Greencastle, Putnam County, Indiana, 46135, United States of America\",\"39.6341514190217\",\"-86.8566327105436\""
3250.1	"\"Kuhio Avenue, Waikiki, Honolulu, Oahu County, Hawaii, 96815, United States of America\",\"21.2790341\",\"-157.8256992\""
3252.1	"\"17844, Lakewood Boulevard, Bellflower, Los Angeles County, California, 90706, United States of America\",\"33.8704262367136\",\"-118.142421422514\""
3251.1	"\"2110, Heather Street Southeast, East Grand Rapids, Kent County, Michigan, 49506, United States of America\",\"42.9356312272727\",\"-85.6161823181818\""
3254.1	"\"5835, South 33rd West Avenue, Tulsa, Tulsa County, Oklahoma, 74107, United States of America\",\"36.0770323624161\",\"-96.0294980604027\""
3255.1	"\"2083, Winewood Avenue, Wildwood, Old West Side, Ann Arbor, Washtenaw County, Michigan, 48103, United States of America\",\"42.277206984302\",\"-83.7748256617915\""
3259.1	"\"Mill Street, Point Arena, Mendocino County, California, 95468, United States of America\",\"38.908408\",\"-123.6908069\""
3260.1	"\"400, North Main Street, High Point, Guilford County, North Carolina, 27260, United States of America\",\"35.9601\",\"-80.007586\""
3263.1	"\"Westport Road, Town of Westport, Dane County, Wisconsin, 53704, United States of America\",\"43.1510305\",\"-89.4042348\""
3267.1	"\"Green Level Church Road, Cary, Wake County, North Carolina, 27519, United States of America\",\"35.8122873\",\"-78.9035115\""
3271.1	"\"2406, Spring Grove Avenue, Camp Washington, Cincinnati, Hamilton County, Ohio, 45214, United States of America\",\"39.1248011222222\",\"-84.5358905888889\""
3273.1	"\"Willow Place, Menlo Park, San Mateo County, California, 94025, United States of America\",\"37.4518513\",\"-122.1667584\""
3280.1	"\"5100, Tiedeman Road, Brooklyn, Cuyahoga County, Ohio, 44144, United States of America\",\"41.4209984369748\",\"-81.7590806218487\""
3282.1	"\"749, Minnesota Avenue, Kansas City, Wyandotte County, Kansas, 66101, United States of America\",\"39.1154646896552\",\"-94.6290396206897\""
3281.1	"\"Miller Community Center, 330, 19th Avenue East, Montlake, Capitol Hill, Seattle, King County, Washington, 98112, United States of America\",\"47.62185395\",\"-122.306919130824\""
3286.1	"\"600, South Independence Boulevard, North Lawndale, Chicago, Cook County, Illinois, 60624, United States of America\",\"41.873389\",\"-87.72047\""
3287.1	"\"US 49, Gulfport, Harrison County, Mississippi, 39502, United States of America\",\"30.4214758\",\"-89.0924859\""
3294.1	"\"839, East California Avenue, Fresno, Fresno County, California, 93706, United States of America\",\"36.7214825588235\",\"-119.800784264706\""
3295.1	"\"1046, North Wilson Avenue, Fresno, Fresno County, California, 93728, United States of America\",\"36.7563083527858\",\"-119.806217577131\""
3296.1	"\"Hillside Road, Oak Ridge, Anderson County, Tennessee, 37830, United States of America\",\"36.0186106\",\"-84.2672819\""
3298.1	"\"South State Street, Jerseyville, Jersey County, Illinois, 62052, United States of America\",\"39.1101512\",\"-90.319624\""
3299.1	"\"5001, Camden Road, Madison, Dane County, Wisconsin, 53716, United States of America\",\"43.0681358568286\",\"-89.3120708970136\""
3300.1	"\"North Howard Street, Allentown, Lehigh County, penna, 18102, United States of America\",\"40.60699\",\"-75.4819439\""
3301.1	"\"2546, 24th Street, Oak Park, Highland Park, Sacramento County, California, 95818, United States of America\",\"38.558023\",\"-121.482122\""
3305.1	"\"850, West Addison Street, Pine Grove, Uptown, Chicago, Cook County, Illinois, 60613, United States of America\",\"41.9473800477082\",\"-87.6510299915769\""
3314.1	"\"1908, 4th Avenue East, Olympia, Thurston County, Washington, 98506, United States of America\",\"47.0461315555556\",\"-122.875151555556\""
3315.1	"\"418, Alabama Avenue, St. Cloud, Kissimmee, Osceola County, Florida, 34769, United States of America\",\"28.254646331862\",\"-81.2959405880704\""
3317.1	"\"Ogunquit Road, South Berwick, York County, Maine, 03908, United States of America\",\"43.25902\",\"-70.6748519\""
3320.1	"\"4395, North Romero Road, Stockham, Tucson, Pima County, Arizona, 85705, United States of America\",\"32.2866776819611\",\"-111.003558169859\""
3321.1	"\"396, La Madera Road, Paako Communities, Bernalillo County, New Mexico, 87047, United States of America\",\"35.210115\",\"-106.364101\""
3323.1	"\"5725, Fondren Road, Houston, Harris County, Texas, 77036, United States of America\",\"29.7191075714286\",\"-95.5199078163265\""
3325.1	"\"2200, Station Street, Indianapolis, Marion County, Indiana, 46218, United States of America\",\"39.798903\",\"-86.103723\""
3326.1	"\"Indianapolis Boulevard, Woodmar, Hammond, Lake County, Indiana, 46324, United States of America\",\"41.57252\",\"-87.4791574\""
3327.1	"\"2500, Shelby Street, Fountain Square, Indianapolis, Marion County, Indiana, 46203, United States of America\",\"39.731994\",\"-86.13978\""
3333.1	"\"University Street, Belltown, Seattle, King County, Washington, 98101, United States of America\",\"47.6070661\",\"-122.3376443\""
3337.1	"\"MS 24, Gloster, Amite County, Mississippi, 39638, United States of America\",\"31.1999133\",\"-91.0099749\""
3338.1	"\"777, North Galloway Avenue, Mesquite, Dallas County, Texas, 75149, United States of America\",\"32.7737867370586\",\"-96.5993211734492\""
3339.1	"\"South 38th Street, Middlesborough, Bell County, Kentucky, 40965, United States of America\",\"36.603927\",\"-83.7423139\""
3341.1	"\"500, Susana Avenue, Redondo Beach, Los Angeles County, California, 90277, United States of America\",\"33.8344763974631\",\"-118.374598302278\""
3348.1	"\"Mount Vernon Avenue, Bakersfield, Kern County, California, 93306, United States of America\",\"35.3948614\",\"-118.967486\""
3349.1	"\"1026, Martha Glass Drive, Jefferson City, Jefferson County, Tennessee, 37760, United States of America\",\"36.1258537114171\",\"-83.4717897003918\""
3352.1	"\"500, Staunton Commons Drive, Troy, Miami County, Ohio, 45373, United States of America\",\"40.043204\",\"-84.193113\""
3353.1	"\"156, Goldonna Road, Natchitoches Parish, Louisiana, 71031, United States of America\",\"32.0075611171762\",\"-92.90956\""
3356.1	"\"El Cajon Drive, Desert Hot Springs, Riverside County, California, 92240, United States of America\",\"33.9504845\",\"-116.5046165\""
3362.1	"\"800, Prospect Street, Fort Morgan, Morgan County, Colorado, 80701, United States of America\",\"40.25686\",\"-103.798759\""
3363.1	"\"500, Charlotte Drive, San Marcos, San Diego County, California, 92069, United States of America\",\"33.146937\",\"-117.164046\""
3364.1	"\"500, Azure Hills Drive, Simi Valley, Ventura County, California, 93065, United States of America\",\"34.250058\",\"-118.767091\""
3367.1	"\"Roberts Avenue, Catonsville Heights, Catonsville, Baltimore County, Maryland, 21228, United States of America\",\"39.2820565\",\"-76.7425693\""
3369.1	"\"2000, East Piru Street, Watts, Long Beach, Los Angeles County, California, 90222, United States of America\",\"33.908359\",\"-118.235934\""
3372.1	"\"1435, East Boulevard, Glenville, Cleveland, Cuyahoga County, Ohio, 44106, United States of America\",\"41.5176168992529\",\"-81.6170664914946\""
3377.1	"\"204, East Indiana Avenue, ספוקיין, Spokane County, Washington, 99207, United States of America\",\"47.674917409121\",\"-117.407844222723\""
3381.1	"\"1755, Slaughter Road, Madison, Madison County, Alabama, 35758, United States of America\",\"34.74812585\",\"-86.71457355\""
3378.1	"\"2200, West Glenwood Avenue, Stanton, Philadelphia, Philadelphia County, penna, 19132, United States of America\",\"39.990419\",\"-75.168752\""
3383.1	"\"Crest Lane, Noble, Cleveland County, Oklahoma, 73068, United States of America\",\"35.1441858\",\"-97.3824091\""
3385.1	"\"West Pico Boulevard, Country Club Park, Cienega, LA, Los Angeles County, California, 90006, United States of America\",\"34.0471894\",\"-118.3090349\""
3389.1	"\"595, Baltimore Pike, Lindill Estates, Bel Air, Harford County, Maryland, 21014, United States of America\",\"39.52551524\",\"-76.35508184\""
3393.1	"\"1329, North Rockwell Street, West Town, Chicago, Cook County, Illinois, 60647, United States of America\",\"41.9056771\",\"-87.691727250588\""
3392.1	"\"6800, South Morgan Street, New Auburn, Chicago, Cook County, Illinois, 60621, United States of America\",\"41.770458\",\"-87.649513\""
3394.1	"\"East 72nd Street, South Shore, Chicago, Cook County, Illinois, 60649, United States of America\",\"41.7643251\",\"-87.5774625\""
3395.1	"\"South Federal Street, Washington Park, Chicago, Cook County, Illinois, 60609, United States of America\",\"41.8019137\",\"-87.628023\""
3396.1	"\"Langdon Farm Rd & Seymour Ave, Langdon Farm Road, Bond Hill, Cincinnati, Hamilton County, Ohio, 45212, United States of America\",\"39.1825027\",\"-84.4555435\""
3398.1	"\"1919, North Dobson Road, Chandler, Maricopa County, Arizona, 85224, United States of America\",\"33.3336345714286\",\"-111.876327085714\""
3399.1	"\"Akard Avenue, Redding, Shasta County, California, 96001, United States of America\",\"40.5710826\",\"-122.3840305\""
3400.1	"\"Duke Street, Alexandria, Alexandria City, Virginia, 22304, United States of America\",\"38.8128745\",\"-77.124693\""
3408.1	"\"807, Miles Avenue, Billings, Yellowstone County, Montana, 59101, United States of America\",\"45.7741791930873\",\"-108.536104754422\""
3410.1	"\"1013, Reed Street, Waycross, Ware County, Georgia, 31501, United States of America\",\"31.209167\",\"-82.347473\""
3413.1	"\"North Kelley Avenue, Oklahoma City, Oklahoma County, Oklahoma, 73131, United States of America\",\"35.551452\",\"-97.4942201\""
3415.1	"\"Roosevelt Avenue, San Antonio, Bexar County, Texas, 78224, United States of America\",\"29.384376\",\"-98.4843039\""
3416.1	"\"Park Avenue, Winter Garden, Orange County, Florida, 34760, United States of America\",\"28.561582\",\"-81.5918627\""
3420.1	"\"654, Williamson Street, Marquette, Madison, Dane County, Wisconsin, 53703, United States of America\",\"43.0765375542876\",\"-89.3742289148774\""
3421.1	"\"777, Park Avenue West, Highland Park, Lake County, Illinois, 60035, United States of America\",\"42.1888965350413\",\"-87.8077865109016\""
3422.1	"\"Brownsville Road, Billy Buck Hill, PGH, Allegheny County, penna, 15210, United States of America\",\"40.4132678\",\"-79.9888159\""
3423.1	"\"North Oracle Road, Amphitheater, Stockham, Tucson, Pima County, Arizona, 85704, United States of America\",\"32.2775409\",\"-110.9782595\""
3424.1	"\"8841, Avril Court North, Fort Worth, Tarrant County, Texas, 76116, United States of America\",\"32.7269084662587\",\"-97.4697468497371\""
3427.1	"\"Bosa Donuts, 190, Avenida de Mesilla, Las Cruces, Doña Ana County, New Mexico, 88005, United States of America\",\"32.2965457\",\"-106.7816096\""
3426.1	"\"Hillside Drive, Cedartown, Polk County, Georgia, 30125, United States of America\",\"34.022259\",\"-85.2476589\""
3429.1	"\"770, Eastern Parkway, Crown Heights, Brooklyn, Kings County, NYC, New York, 11213, United States of America\",\"40.6689619\",\"-73.9427979769362\""
3430.1	"\"East La Palma Avenue, Anaheim Resort District, Anaheim, Orange County, California, 92807, United States of America\",\"33.8472685\",\"-117.8935437\""
3433.1	"\"1325, West North Street, Muncie, Delaware County, Indiana, 47303, United States of America\",\"40.1966015454545\",\"-85.4007136060606\""
3438.1	"\"US 70;US 321 Business, Hickory, Catawba County, North Carolina, 28602, United States of America\",\"35.7221476\",\"-81.3557564\""
3443.1	"\"MacKerricher State Park, Mackerricher State Park Road, Cleone, Mendocino County, California, 95437, United States of America\",\"39.4932207\",\"-123.7936268\""
3452.1	"\"Wehring Road, Richland Hills, Tarrant County, Texas, 76118, United States of America\",\"32.810758\",\"-97.2366619\""
3455.1	"\"Long Avenue, Kelso, Cowlitz County, Washington, 98626, United States of America\",\"46.1485791\",\"-122.9191607\""
3456.1	"\"South Church Street, Wernersville, Berks County, penna, 19565, United States of America\",\"40.325534\",\"-76.0749039\""
3460.1	"\"1550, Empire Central Drive, Dallas, Dallas County, Texas, 75235, United States of America\",\"32.826395\",\"-96.865172\""
3462.1	"\"147, North Harrison Boulevard, Ogden, Weber County, Utah, 84404, United States of America\",\"41.2613861962428\",\"-111.947947957193\""
3463.1	"\"2508, Sweetbriar Drive, San Angelo, Tom Green County, Texas, 76904, United States of America\",\"31.4230470927392\",\"-100.468690332582\""
3467.1	"\"Ridge Road, Rutherford, Bergen County, New Jersey, 07071, United States of America\",\"40.8161949\",\"-74.1130744\""
3470.1	"\"8803, Lucas & Hunt Road, Jennings, St. Louis County, Missouri, 63136, United States of America\",\"38.732824\",\"-90.262691\""
3472.1	"\"4288, South Alita Terrace, Homosassa Springs, Citrus County, Florida, 34446, United States of America\",\"28.7980093108435\",\"-82.5162333288147\""
3473.1	"\"225, Herman Avenue, Mansfield, Richland County, Ohio, 44903, United States of America\",\"40.7626115217391\",\"-82.5239004347826\""
3474.1	"\"16th Avenue, Lucerne, Lake County, California, 95458, United States of America\",\"39.085755\",\"-122.7904789\""
3478.1	"\"2700, South California Avenue, Bohemian California, Chicago, Cook County, Illinois, 60608, United States of America\",\"41.8411519919373\",\"-87.6952400570955\""
3479.1	"\"5th District (Calumet) Police Station, 727, East 111th Street, Pullman, Chicago, Cook County, Illinois, 60628, United States of America\",\"41.69220565\",\"-87.6037643922888\""
3484.1	"\"Pulaski Highway, Annes Delight, Joppatowne, Harford County, Maryland, 21085, United States of America\",\"39.4317923\",\"-76.338387\""
3491.1	"\"6232, Melbourne Road, Allen T. Stevens, Raleigh, Wake County, North Carolina, 27603, United States of America\",\"35.6965727151623\",\"-78.6868007159443\""
3493.1	"\"Old Baton Rouge Highway, Hammond, Tangipahoa Parish, Louisiana, 70403, United States of America\",\"30.4944921\",\"-90.4925657\""
3495.1	"\"1421, Hornchurch Avenue, Casper, Natrona County, Wyoming, 82609, United States of America\",\"42.832578906933\",\"-106.266784233889\""
3498.1	"\"5020, Roaming Plains Court, Louisville, Jefferson County, Kentucky, 40229, United States of America\",\"38.1079395\",\"-85.6637896975763\""
3499.1	"\"11703, Kirkmeadow Drive, Houston, Harris County, Texas, 77089, United States of America\",\"29.6042010474454\",\"-95.2262533370863\""
3501.1	"\"501, McClain Street, Goose Creek, Berkeley County, South Carolina, 29445, United States of America\",\"32.990908\",\"-80.037721\""
3502.1	"\"261, Pine Street, Laplace, St. John the Baptist Parish, Louisiana, 70068, United States of America\",\"30.061960198528\",\"-90.4907612949835\""
3507.1	"\"22, Skelton Road, Athens-Clarke County, Clarke County, Georgia, 30605, United States of America\",\"33.9561846793347\",\"-83.3253800272326\""
3508.1	"\"North University Drive, Sunrise, Broward County, Florida, 33321, United States of America\",\"26.1635195\",\"-80.2567755\""
3513.1	"\"11000, Beach Boulevard, Jacksonville, Duval County, Florida, 32246, United States of America\",\"30.286759\",\"-81.533363\""
3500.1	"\"Heather Drive Northwest, Christiansburg, Montgomery County, Virginia, 24073, United States of America\",\"37.1757032\",\"-80.4388744\""
3520.1	"\"3900, Lovers Lane Circle, University Park, Dallas County, Texas, 75225, United States of America\",\"32.850086\",\"-96.799546\""
3525.1	"\"Harrison Street, Green Cove Springs, Clay County, Florida, 32043, United States of America\",\"29.9947046\",\"-81.686799\""
3531.1	"\"220, Northeast 12th Avenue, Homestead, Miami-Dade County, Florida, 33030, United States of America\",\"25.4708706852882\",\"-80.4608975000724\""
3532.1	"\"1310, Williamston Road, Anderson, Anderson County, South Carolina, 29621, United States of America\",\"34.504969\",\"-82.608327\""
3534.1	"\"South Sheridan Road, Tulsa, Tulsa County, Oklahoma, 74008, United States of America\",\"36.1162518\",\"-95.904492\""
3537.1	"\"700, East Alosta Avenue, Azusa, Los Angeles County, California, 91702, United States of America\",\"34.132102\",\"-117.896176\""
3541.1	"\"4412, 10th Avenue North, Central Oak Park, St. Petersburg, Pinellas County, Florida, 33713, United States of America\",\"27.7817360234332\",\"-82.6928850092645\""
3543.1	"\"8800, Avril Court South, Fort Worth, Tarrant County, Texas, 76116, United States of America\",\"32.725882\",\"-97.46932\""
3547.1	"\"Springfield Street, Elmhurst, Oakland, Alameda County, California, 94603, United States of America\",\"37.7484145\",\"-122.1604525\""
3548.1	"\"600 South, East Liberty Park, Greater Avenues, Salt Lake City, Salt Lake County, Utah, 84102, United States of America\",\"40.7563231\",\"-111.8682699\""
3560.1	"\"Miami Shores, Miami-Dade County, Florida, United States of America\",\"25.8631515\",\"-80.1928253\""
3561.1	"\"8500, Northwest 21st Court, Sunrise, Broward County, Florida, 33322, United States of America\",\"26.152042\",\"-80.262982\""
3570.1	"\"500, Saint Thomas Williamson Road, Saint Thomas, Franklin County, penna, 17252, United States of America\",\"39.9139400102011\",\"-77.7949603375582\""
3571.1	"\"3018, Merrill Avenue, Clearwater, Pinellas County, Florida, 33759, United States of America\",\"27.97169975\",\"-82.7120305\""
3573.1	"\"Fort Armistead Road, Hawkins Point, Baltimore, Maryland, 21226, United States of America\",\"39.2006648\",\"-76.5534389\""
3574.1	"\"Fort Armistead Road, Hawkins Point, Baltimore, Maryland, 21226, United States of America\",\"39.2006648\",\"-76.5534389\""
3575.1	"\"10211, Lem Turner Road, Jacksonville, Duval County, Florida, 32218, United States of America\",\"30.4212164250246\",\"-81.696304681026\""
3576.1	"\"Fort Armistead Road, Hawkins Point, Baltimore, Maryland, 21226, United States of America\",\"39.2006648\",\"-76.5534389\""
3578.1	"\"8400, 3500 South, Magna, Salt Lake County, Utah, 84044, United States of America\",\"40.696577\",\"-112.09194\""
3581.1	"\"Clark Street, Grantsville, Tooele County, Utah, 84029, United States of America\",\"40.6023014\",\"-112.486677\""
3582.1	"\"I 15, Kaysville, Davis County, Utah, 84037, United States of America\",\"41.004362\",\"-111.9294899\""
3583.1	"\"5686, Redwood Road, Taylorsville, Salt Lake County, Utah, 84123, United States of America\",\"40.6481498666667\",\"-111.938699\""
3585.1	"\"250, Main Street, Central City, Capitol Hill, Salt Lake City, Salt Lake County, Utah, 84101, United States of America\",\"40.7638913061224\",\"-111.891201\""
3586.1	"\"Paine Road, Magna, Salt Lake County, Utah, 84044, United States of America\",\"40.689728\",\"-112.068569\""
3587.1	"\"2805, 3600 West, West Valley City, Salt Lake County, Utah, 84119, United States of America\",\"40.7091713303017\",\"-111.977025742644\""
3590.1	"\"100, South 500 West, Salina, Sevier County, Utah, 84654, United States of America\",\"38.956842253615\",\"-111.868566574249\""
3591.1	"\"2500 West, West Valley City, Salt Lake County, Utah, 84119, United States of America\",\"40.7115703\",\"-111.9545352\""
3593.1	"\"1601, 400 South, Poplar Grove, Capitol Hill, Salt Lake City, Salt Lake County, Utah, 84104, United States of America\",\"40.7605360313743\",\"-111.936617090911\""
3594.1	"\"4344, Adams Avenue, South Ogden, Weber County, Utah, 84403, United States of America\",\"41.1831521317444\",\"-111.968276115713\""
3596.1	"\"4000 West, Daybreak Community, South Jordan, Salt Lake County, Utah, 84088, United States of America\",\"40.5765393\",\"-111.9863765\""
3597.1	"\"3676, West Bawden Avenue, West Valley City, Salt Lake County, Utah, 84120, United States of America\",\"40.679944\",\"-111.97884020339\""
3599.1	"\"990, North 500 West, West Bountiful, Davis County, Utah, 84010, United States of America\",\"40.8985219714286\",\"-111.892065342857\""
3601.1	"\"South Temple, Central City, Capitol Hill, Salt Lake City, Salt Lake County, Utah, 84101; 84102, United States of America\",\"40.7693404\",\"-111.8853761\""
3602.1	"\"400, East 700 South, Roosevelt, Duchesne County, Utah, 84066, United States of America\",\"40.2895642811438\",\"-109.985580964607\""
3603.1	"\"3470, Redwood Road, West Valley City, Salt Lake County, Utah, 84119, United States of America\",\"40.6972330032475\",\"-111.939010986173\""
3604.1	"\"625 East, South Cottonwood Acres, Murray, Salt Lake County, Utah, 84107, United States of America\",\"40.6475557\",\"-111.8736671\""
3615.1	"\"1300, 2400 South, West Valley City, Salt Lake County, Utah, 84119, United States of America\",\"40.718831\",\"-111.931126\""
3616.1	"\"115, East 100 North, Farmington, Davis County, Utah, 84025, United States of America\",\"40.9821854285714\",\"-111.884937\""
3618.1	"\"909, South 50 East, Hyde Park, Cache County, Utah, 84318, United States of America\",\"41.781631\",\"-111.818463\""
3619.1	"\"3538, Redwood Road, West Valley City, Salt Lake County, Utah, 84119, United States of America\",\"40.6957173886115\",\"-111.93900733243\""
3620.1	"\"1000, East Main Street, Lehi, Utah County, Utah, 84043, United States of America\",\"40.3881637961165\",\"-111.835367941748\""
3621.1	"\"600, 600 East, Central City, Greater Avenues, Salt Lake City, Salt Lake County, Utah, 84102, United States of America\",\"40.756188\",\"-111.874025\""
3624.1	"\"415, 8400 South, Sandy, Salt Lake County, Utah, 84070, United States of America\",\"40.598757580949\",\"-111.878945042154\""
3625.1	"\"3336, 3500 South, West Valley City, Salt Lake County, Utah, 84119, United States of America\",\"40.696711\",\"-111.970976785652\""
3626.1	"\"300 West, Marmalade District, Capitol Hill, Salt Lake City, Salt Lake County, Utah, 84103, United States of America\",\"40.7704013\",\"-111.899757\""
3627.1	"\"400, North 500 West, Moab, Grand County, Utah, 84532, United States of America\",\"38.5797133649585\",\"-109.561075238974\""
3628.1	"\"3500, 4800 West, West Valley City, Salt Lake County, Utah, 84120, United States of America\",\"40.696453\",\"-112.005832\""
3630.1	"\"5600 South, Taylorsville, Salt Lake County, Utah, 84123, United States of America\",\"40.6493415\",\"-111.9388145\""
3631.1	"\"Green Street, East Liberty Park, Greater Avenues, Salt Lake City, Salt Lake County, Utah, 84102, United States of America\",\"40.751966\",\"-111.8724534\""
3633.1	"\"368, 28th Street, Ogden, Weber County, Utah, 84401, United States of America\",\"41.2144793786766\",\"-111.971315033114\""
3635.1	"\"4800, 3500 South, West Valley City, Salt Lake County, Utah, 84120, United States of America\",\"40.696659\",\"-112.005819\""
3639.1	"\"200 East, Liberty-Wells, Capitol Hill, Salt Lake City, Salt Lake County, Utah, 84111, United States of America\",\"40.7391574\",\"-111.8853778\""
3645.1	"\"315, Rackley Street, Statesboro, Bulloch County, Georgia, 30458, United States of America\",\"32.4380194712106\",\"-81.7875068497096\""
3648.1	"\"1702, East 38th Street, Erie, Erie County, penna, 16510, United States of America\",\"42.1158773754489\",\"-80.0299339354013\""
